{"entryState":"binding:idle","profile":{"id":"actor:CKHkAsterix","module":"GameModule.elb","moduleSha256":"35e780a40e4ee625430cb37982deebd085960c37091f3a60465c5aa207ab58a0","owner":"CKHkAsterix"},"resourceType":"asterix.authored-animation-graph","schemaVersion":1,"source":{"schemaVersion":1,"sha256":"3e66f521094b320029112ac75e6631936002fa4bd9762022fe7b6771d94cfb06"},"states":[{"binding":"idle","clip":{"asset":"clip-0058","dictionary":0,"slot":0},"id":"binding:idle","phaseEvents":{"events":[],"initialPhase":0.0},"playback":{"rate":1.0},"profile":"actor:CKHkAsterix","provenanceEvidenceId":"task93:v1:ac89d0654a3e2e2e373e4261be851582437b06e543297a6e137f8331064fc669","rootMotion":{"policy":"inPlace"},"runtimeState":"locomotion.idle"},{"binding":"run","clip":{"asset":"clip-0035","dictionary":0,"slot":2},"id":"binding:run","phaseEvents":{"events":[],"initialPhase":0.0},"playback":{"rate":1.0},"profile":"actor:CKHkAsterix","provenanceEvidenceId":"task93:v1:e898c0d1cf00ce92a08bd31df965bc82ba200d4a437fc4019c786a95ae1c6a13","rootMotion":{"policy":"inPlace"},"runtimeState":"locomotion.run"},{"binding":"hero_slot_3","clip":{"asset":"clip-0025","dictionary":0,"slot":3},"id":"binding:hero_slot_3","phaseEvents":{"events":[],"initialPhase":0.0},"playback":{"rate":1.0},"profile":"actor:CKHkAsterix","provenanceEvidenceId":"task93:v1:9758e4220e604dcfafa7a54503e776c2ad21189eb2428a9dc18d811c32bf545b","rootMotion":{"policy":"inPlace"},"runtimeState":"locomotion.move-directional"},{"binding":"hero_slot_4","clip":{"asset":"clip-0024","dictionary":0,"slot":4},"id":"binding:hero_slot_4","phaseEvents":{"events":[],"initialPhase":0.0},"playback":{"rate":1.0},"profile":"actor:CKHkAsterix","provenanceEvidenceId":"task93:v1:178405e7f593080acbea7a2702905a97a3abd5104b7ad1eebbb27d50112c09cc","rootMotion":{"policy":"inPlace"},"runtimeState":"locomotion.move-directional"},{"binding":"hero_slot_5","clip":{"asset":"clip-0034","dictionary":0,"slot":5},"id":"binding:hero_slot_5","phaseEvents":{"events":[],"initialPhase":0.0},"playback":{"rate":1.0},"profile":"actor:CKHkAsterix","provenanceEvidenceId":"task93:v1:4c5f86ae4fe96094b793eb2d7b75b6c5a6dac3b6285628bab5a1921a16b82d91","rootMotion":{"policy":"inPlace"},"runtimeState":"locomotion.move-directional"},{"binding":"hero_slot_6","clip":{"asset":"clip-0032","dictionary":0,"slot":6},"id":"binding:hero_slot_6","phaseEvents":{"events":[],"initialPhase":0.0},"playback":{"rate":1.0},"profile":"actor:CKHkAsterix","provenanceEvidenceId":"task93:v1:3685c8d1ac352f4df75467a6a5c7d82c51c8b22dc164cd40347c0f3fb5d2b9eb","rootMotion":{"policy":"inPlace"},"runtimeState":"locomotion.move-directional"},{"binding":"hero_slot_7","clip":{"asset":"clip-0023","dictionary":0,"slot":7},"id":"binding:hero_slot_7","phaseEvents":{"events":[],"initialPhase":0.0},"playback":{"rate":1.0},"profile":"actor:CKHkAsterix","provenanceEvidenceId":"task93:v1:21deb36ebb38172cfb6b44dd5d5c5df3f6934578f137cd849765fbc500d12e9f","rootMotion":{"policy":"inPlace"},"runtimeState":"locomotion.move-directional"},{"binding":"hero_slot_8","clip":{"asset":"clip-0053","dictionary":0,"slot":8},"id":"binding:hero_slot_8","phaseEvents":{"events":[],"initialPhase":0.0},"playback":{"rate":1.0},"profile":"actor:CKHkAsterix","provenanceEvidenceId":"task93:v1:537883593ad27f4ae7b892ad9d7d3f27c5039c7dd537e9eb559a25c256a40428","rootMotion":{"policy":"inPlace"},"runtimeState":"locomotion.idle"},{"binding":"hero_slot_9","clip":{"asset":"clip-0054","dictionary":0,"slot":9},"id":"binding:hero_slot_9","phaseEvents":{"events":["completion"],"initialPhase":0.0},"playback":{"rate":1.0},"profile":"actor:CKHkAsterix","provenanceEvidenceId":"task93:v1:0223dc9df79217450c2bc85650ffa2f4653df0a3caba784f28282ac32c42b697","rootMotion":{"policy":"inPlace"},"runtimeState":"locomotion.idle-variant"},{"binding":"hero_slot_10","clip":{"asset":"clip-0055","dictionary":0,"slot":10},"id":"binding:hero_slot_10","phaseEvents":{"events":["completion"],"initialPhase":0.0},"playback":{"rate":1.0},"profile":"actor:CKHkAsterix","provenanceEvidenceId":"task93:v1:acb1f097fdc4d7e8dcbf97b1f8a72d132afaca3ba720af87520db6f20e23ee08","rootMotion":{"policy":"inPlace"},"runtimeState":"locomotion.idle-variant"},{"binding":"hero_slot_11","clip":{"asset":"clip-0056","dictionary":0,"slot":11},"id":"binding:hero_slot_11","phaseEvents":{"events":["completion"],"initialPhase":0.0},"playback":{"rate":1.0},"profile":"actor:CKHkAsterix","provenanceEvidenceId":"task93:v1:88d2f63ed542189f5324049b32d012c28b4a41edc4277a6ebcfc7629e83bfa12","rootMotion":{"policy":"inPlace"},"runtimeState":"locomotion.idle-variant"},{"binding":"hero_slot_12","clip":{"asset":"clip-0057","dictionary":0,"slot":12},"id":"binding:hero_slot_12","phaseEvents":{"events":["completion"],"initialPhase":0.0},"playback":{"rate":1.0},"profile":"actor:CKHkAsterix","provenanceEvidenceId":"task93:v1:973bee1c0775b81e3bf8a51d0ae6ce99d8b65f7ae47329f85c1ebd7259fd15f7","rootMotion":{"policy":"inPlace"},"runtimeState":"locomotion.idle-variant"},{"binding":"jump","clip":{"asset":"clip-0031","dictionary":0,"slot":13},"id":"binding:jump","phaseEvents":{"events":["takeoff","completion"],"initialPhase":0.0},"playback":{"rate":1.0},"profile":"actor:CKHkAsterix","provenanceEvidenceId":"task93:v1:dc5386791ff5134ed3e6682c2f7976364fc8d2c11ceb92618f3e2f3c64eb2b70","rootMotion":{"policy":"physicsDriven"},"runtimeState":"locomotion.jump"},{"binding":"hero_slot_14","clip":{"asset":"clip-0060","dictionary":0,"slot":14},"id":"binding:hero_slot_14","phaseEvents":{"events":["completion"],"initialPhase":0.0},"playback":{"rate":1.0},"profile":"actor:CKHkAsterix","provenanceEvidenceId":"task93:v1:7690872a6de434047d12cf09e86b7edc6279136f8c42ae477b9db678d0c6a57e","rootMotion":{"policy":"inPlace"},"runtimeState":"locomotion.transition"},{"binding":"hero_slot_15","clip":{"asset":"clip-0046","dictionary":0,"slot":15},"id":"binding:hero_slot_15","phaseEvents":{"events":["completion"],"initialPhase":0.0},"playback":{"rate":1.0},"profile":"actor:CKHkAsterix","provenanceEvidenceId":"task93:v1:c137530cfe4214afca59891c2b88a7a9b60c43732d8edf0a0914c51c882aa53f","rootMotion":{"policy":"inPlace"},"runtimeState":"locomotion.transition"},{"binding":"hero_slot_16","clip":{"asset":"clip-0050","dictionary":0,"slot":16},"id":"binding:hero_slot_16","phaseEvents":{"events":["hitWindow","comboWindow","completion"],"initialPhase":0.0},"playback":{"rate":1.0},"profile":"actor:CKHkAsterix","provenanceEvidenceId":"task93:v1:638d9d48de4d30e0cc0ff2155b999586c913f6dfb6ae8db183de10687fc0a474","rootMotion":{"policy":"authored"},"runtimeState":"combat.attack-combo"},{"binding":"hero_slot_17","clip":{"asset":"clip-0042","dictionary":0,"slot":17},"id":"binding:hero_slot_17","phaseEvents":{"events":["hitWindow","comboWindow","completion"],"initialPhase":0.0},"playback":{"rate":1.0},"profile":"actor:CKHkAsterix","provenanceEvidenceId":"task93:v1:5c7bc9c448858848057005d7faadf3a9af10c7fd6015319b5111a898ce1e8bd7","rootMotion":{"policy":"authored"},"runtimeState":"combat.attack-combo"},{"binding":"attack","clip":{"asset":"clip-0000","dictionary":0,"slot":18},"id":"binding:attack","phaseEvents":{"events":["hitWindow","comboWindow","completion"],"initialPhase":0.0},"playback":{"rate":1.0},"profile":"actor:CKHkAsterix","provenanceEvidenceId":"task93:v1:9843ee8ff889fe4f6366e77e7bc02fb323e272a3831910e2de1bf7791f19cefb","rootMotion":{"policy":"authored"},"runtimeState":"combat.attack"},{"binding":"hero_slot_19","clip":{"asset":"clip-0049","dictionary":0,"slot":19},"id":"binding:hero_slot_19","phaseEvents":{"events":["hitWindow","comboWindow","completion"],"initialPhase":0.0},"playback":{"rate":1.0},"profile":"actor:CKHkAsterix","provenanceEvidenceId":"task93:v1:6c5061787bb1f4b05334f2db54c627eec65ec0ed6d96576c49e63b0e798fd0a3","rootMotion":{"policy":"authored"},"runtimeState":"combat.attack-combo"},{"binding":"hero_slot_20","clip":{"asset":"clip-0041","dictionary":0,"slot":20},"id":"binding:hero_slot_20","phaseEvents":{"events":["hitWindow","comboWindow","completion"],"initialPhase":0.0},"playback":{"rate":1.0},"profile":"actor:CKHkAsterix","provenanceEvidenceId":"task93:v1:2a25ff441c3191b1635d48ce53612efcbb72c6f643d5f372d56f52fc0afcd977","rootMotion":{"policy":"authored"},"runtimeState":"combat.attack-combo"},{"binding":"hero_slot_21","clip":{"asset":"clip-0045","dictionary":0,"slot":21},"id":"binding:hero_slot_21","phaseEvents":{"events":["hitWindow","comboWindow","completion"],"initialPhase":0.0},"playback":{"rate":1.0},"profile":"actor:CKHkAsterix","provenanceEvidenceId":"task93:v1:363ade7fb2512c152d1eab89fd93d3e3e28b4bbf401e8bbb2e6d02844865b24d","rootMotion":{"policy":"authored"},"runtimeState":"combat.attack-combo"},{"binding":"hero_slot_22","clip":{"asset":"clip-0048","dictionary":0,"slot":22},"id":"binding:hero_slot_22","phaseEvents":{"events":["hitWindow","comboWindow","completion"],"initialPhase":0.0},"playback":{"rate":1.0},"profile":"actor:CKHkAsterix","provenanceEvidenceId":"task93:v1:09799f2dbacb4cf4f2b44c54650d47f67147627146f5e0e531f01688efa1bec6","rootMotion":{"policy":"authored"},"runtimeState":"combat.attack-combo"},{"binding":"hero_slot_23","clip":{"asset":"clip-0044","dictionary":0,"slot":23},"id":"binding:hero_slot_23","phaseEvents":{"events":["hitWindow","comboWindow","completion"],"initialPhase":0.0},"playback":{"rate":1.0},"profile":"actor:CKHkAsterix","provenanceEvidenceId":"task93:v1:3ec0d752eeea9d330b15b01f2bbaf236da5ea5dad1cefa3e34acb9151dd6e0d5","rootMotion":{"policy":"authored"},"runtimeState":"combat.attack-combo"},{"binding":"hero_slot_25","clip":{"asset":"clip-0052","dictionary":0,"slot":25},"id":"binding:hero_slot_25","phaseEvents":{"events":["hitWindow","comboWindow","completion"],"initialPhase":0.0},"playback":{"rate":1.0},"profile":"actor:CKHkAsterix","provenanceEvidenceId":"task93:v1:9960af2b50c631b3b1ba023c1ed59be2b13259434431d7e18dabc57ac8c8e5f3","rootMotion":{"policy":"authored"},"runtimeState":"combat.attack-combo"},{"binding":"hero_slot_26","clip":{"asset":"clip-0043","dictionary":0,"slot